{
  "schema_version": 1,
  "device": {
    "vendor": "FILL_ME",
    "model": "FILL_ME",
    "firmware": "FILL_ME",
    "profile_revision": "FILL_ME"
  },
  "capabilities": {
    "CHANNEL.TCP.CLIENT": "UNKNOWN",
    "CHANNEL.UDP": "UNKNOWN",
    "CHANNEL.RECONNECT": "UNKNOWN",
    "LINK.BROADCAST": "UNKNOWN",
    "APP.FC.01.READ": "UNKNOWN",
    "APP.FC.03.SELECT": "UNKNOWN",
    "APP.FC.04.OPERATE": "UNKNOWN",
    "APP.FC.05.DIRECT_OPERATE": "UNKNOWN",
    "APP.FC.06.DIRECT_OPERATE_NR": "UNKNOWN",
    "APP.FC.14.ENABLE_UNSOLICITED": "UNKNOWN",
    "APP.FC.15.DISABLE_UNSOLICITED": "UNKNOWN",
    "APP.FC.82.UNSOLICITED_RESPONSE": "UNKNOWN",
    "APP.UNSOLICITED": "UNKNOWN",
    "APP.TASK.LIFECYCLE": "UNKNOWN",
    "APP.TASK.OBSERVABILITY": "UNKNOWN",
    "APP.CLASS.EVENTS": "UNKNOWN",
    "APP.COMMAND_STATUS.CATALOG": "UNKNOWN",
    "IIN.IIN2.1.OBJECT_UNKNOWN": "UNKNOWN",
    "OBJ.G1.V2": "UNKNOWN",
    "OBJ.G2.V2": "UNKNOWN",
    "OBJ.G3.V2": "UNKNOWN",
    "OBJ.G10.V2": "UNKNOWN",
    "OBJ.G12.V1": "UNKNOWN",
    "OBJ.G20.V1": "UNKNOWN",
    "OBJ.G21.V1": "UNKNOWN",
    "OBJ.G30.V5": "UNKNOWN",
    "OBJ.G32.V7": "UNKNOWN",
    "OBJ.G40.V1": "UNKNOWN",
    "OBJ.G40.V3": "UNKNOWN",
    "OBJ.G41.V1": "UNKNOWN",
    "OBJ.G41.V2": "UNKNOWN",
    "OBJ.G41.V3": "UNKNOWN",
    "OBJ.G41.V4": "UNKNOWN",
    "OBJ.G50.V4": "UNKNOWN",
    "OBJ.G60.V1": "UNKNOWN",
    "OBJ.G60.V2": "UNKNOWN",
    "OBJ.G60.V3": "UNKNOWN",
    "OBJ.G60.V4": "UNKNOWN",
    "QUAL.Q00.REVIEW": "UNKNOWN",
    "QUAL.Q01.REVIEW": "UNKNOWN",
    "QUAL.Q02.REVIEW": "UNKNOWN",
    "QUAL.Q06.REVIEW": "UNKNOWN",
    "QUAL.Q07.REVIEW": "UNKNOWN",
    "QUAL.Q08.REVIEW": "UNKNOWN",
    "QUAL.Q09.REVIEW": "UNKNOWN",
    "QUAL.Q17.REVIEW": "UNKNOWN",
    "QUAL.Q28.REVIEW": "UNKNOWN",
    "QUAL.Q39.REVIEW": "UNKNOWN",
    "QUAL.FAMILY.INDEX_PREFIX": "UNKNOWN",
    "OBJ.G110.LENGTH_VARIANTS": "UNKNOWN"
  },
  "notes": "Copy this file to a non-committed local path and replace each status only from the EMS Device Profile/PICS or an approved project decision."
}
